Page number,Author Name,Author affiliation,Email,Co-author 1 Name,Co-author 1 Affiliation,Co-author 1 Email,Co-author 2 Name,Co-author 2 Affiliation,Co-author 2 Email,Co-author 3 Name,Co-author 3 Affiliation,Co-author 3 Email,Co-author 4 Name,Co-author 4 Affiliation,Co-author 4 Email,Co-author 5 Name,Co-author 5 Affiliation,Co-author 5 Email,Co-author 6 Name,Co-author 6 Affiliation,Co-author 6 Email,Co-author 7 Name,Co-author 7 Affiliation,Co-author 7 Email,Co-author 8 Name,Co-author 8 Affiliation,Co-author 8 Email,Co-author 9 Name,Co-author 9 Affiliation,Co-author 9 Email,Article 1 Title,Article 1 URL,Article 1 Journal,Article 1 Pub Date,Article 1 Abstract,Article 2 Title,Article 2 URL,Article 2 Journal,Article 2 Pub Date,Article 2 Abstract,Article 3 Title,Article 3 URL,Article 3 Journal,Article 3 Pub Date,Article 3 Abstract,Article 4 Title,Article 4 URL,Article 4 Journal,Article 4 Pub Date,Article 4 Abstract,Article 5 Title,Article 5 URL,Article 5 Journal,Article 5 Pub Date,Article 5 Abstract,Article 6 Title,Article 6 URL,Article 6 Journal,Article 6 Pub Date,Article 6 Abstract,Article 7 Title,Article 7 URL,Article 7 Journal,Article 7 Pub Date,Article 7 Abstract,Article 8 Title,Article 8 URL,Article 8 Journal,Article 8 Pub Date,Article 8 Abstract,Article 9 Title,Article 9 URL,Article 9 Journal,Article 9 Pub Date,Article 9 Abstract,Article 10 Title,Article 10 URL,Article 10 Journal,Article 10 Pub Date,Article 10 Abstract
0,RAbooshahab,"Cellular and Molecular Endocrine Research Center, Research Institute for Endocrine Sciences, Shahid Beheshti University of Medical Sciences, Tehran 1985717413, Iran.",,ENiyazi,"Department of Biology, Faculty of Basic Sciences, Science Research Branch of Islamic Azad University, Tehran 1477893855, Iran.",,PYaghmaie,"Department of Biology, Faculty of Basic Sciences, Science Research Branch of Islamic Azad University, Tehran 1477893855, Iran.",,H GGhadaksaz,"Cellular and Molecular Endocrine Research Center, Research Institute for Endocrine Sciences, Shahid Beheshti University of Medical Sciences, Tehran 1985717413, Iran.",,MHedayati,"Cellular and Molecular Endocrine Research Center, Research Institute for Endocrine Sciences, Shahid Beheshti University of Medical Sciences, Tehran 1985717413, Iran.",,G VGerashchenko,"Institute of Molecular Biology and Genetics, NAS of Ukraine, Kyiv 03680, Ukraine.",,O VGrygoruk,"Clinic ""Boris"", Kyiv 02140, Ukraine.",,O AKononenko,"National Cancer Institute, Kyiv 03022, Ukraine.",,O PGryzodub,"Institute of Urology, NAMS of Ukraine, Kyiv 04053, Ukraine.",,E OStakhovsky,"National Cancer Institute, Kyiv 03022, Ukraine.",,Professor Volodymyr Oleksiiovych Shlyakhovenko (on the 80th birth anniversary).,https://www.ncbi.nlm.nih.gov/pubmed/30593753,Experimental oncology,2019 04 03,"In September 2018, Professor Volodymyr Oleksiiovych Shlyakhovenko, well-known Ukrainian scientist in the field of cancer biochemistry, celebrated his 80th anniversary.",Serum level of dipeptidyl peptidase-4 as a potential biomarker for medullary thyroid cancer.,https://www.ncbi.nlm.nih.gov/pubmed/30593752,Experimental oncology,2019 04 03,"Adipokines are the proteins secreted from adipose tissue and play an important role in the control of metabolism. Dipeptidyl peptidase-4 (DPP4) is a novel adipokine with different biological role. As indicated by various studies, serum levels of DPP4 had been associated with body mass index (BMI), insulin resistance, metabolic syndrome and malignancy. The aim of this study was to assess the serum levels of DPP4 in patients with medullary thyroid cancer (MTC) in comparison with these in the control group.",Expression pattern of genes associated with tumor microenvironment in prostate cancer.,https://www.ncbi.nlm.nih.gov/pubmed/30593751,Experimental oncology,2019 04 03,"To assess relative expression (RE) levels of CAF-, TAM-specific, immune defense-associated genes in prostate tumors and to show correlation of RE with clinical, pathological and molecular characteristics, with the aim to define clinically significant specific alterations in a gene expression pattern.",Overexpression of the mitochondrial ribosomal protein S18-2 in the invasive breast carcinomas.,https://www.ncbi.nlm.nih.gov/pubmed/30593750,Experimental oncology,2019 04 03,"Recent studies allow to consider the mitochondrial ribosomal protein S18-2 (MRPS18-2, S18-2) as a potential oncoprotein, which suggests the need for further characterization of its expression in tumors of different genesis including breast cancer (BC). The aim of the study was to analyze the expression of the S18-2 protein in BC of luminal A and basal subtypes.",FoxP3 gene polymorphism is associated with breast cancer in Iranian patients.,https://www.ncbi.nlm.nih.gov/pubmed/30593749,Experimental oncology,2019 04 03,"Breast cancer (BC) is one of the leading causes of cancer death among women. Recent studies have characterized FoxP3 as a marker of regulatory T cells and an X-linked tumor suppressor gene, which is involved in the pathogenesis of BC. Therefore, we investigated the potential influence of three single-nucleotide polymorphisms (SNPs) of FoxP3 gene on the development of BC in Iranian women.",Oxidative and mutagenic effects of low intensity GSM 1800 MHz microwave radiation.,https://www.ncbi.nlm.nih.gov/pubmed/30593748,Experimental oncology,2019 04 03,"Despite a significant number of epidemiological studies on potential carcinogenicity of microwave radiation (MWR) from wireless devices and a bulk of experimental studies on oxidative and mutagenic effects of low intensity MWR, the discussion on potential carcinogenicity of low intensity MWR is going on. This study aims to assess oxidative and mutagenic effects of low intensity MWR from a typical commercial model of a modern smartphone.",The effects of early postoperative immunization with xenogeneic embryo proteins on Lewis lung carcinoma model.,https://www.ncbi.nlm.nih.gov/pubmed/30593747,Experimental oncology,2019 04 03,To investigate the effect of chicken embryo proteins (CEP) as a prototype of xenogeneic vaccine on immune reactions in mice immunized after Lewis lung carcinoma (LLC) surgical removal.,Association of interleukin-1 gene polymorphism with risk of gastric and colorectal cancers in an Iranian population.,https://www.ncbi.nlm.nih.gov/pubmed/30593746,Iranian journal of immunology : IJI,2019 04 08,"Chronic inflammation is associated with neoplasms and several types of cancer. Therefore, polymorphisms in the inflammation-related genes could modify the cancer susceptibility.",Inherited Classical and Alternative Pathway Complement Deficiencies in Children: A Single Center Experience.,https://www.ncbi.nlm.nih.gov/pubmed/30593745,Iranian journal of immunology : IJI,2019 04 08,Primary complement deficiencies are rare diseases.,"T-helper-17, Regulatory T-helper Cells Related Serum Markers and IL-13 in the Outcome of Polytraumatic Patients with Bacteremia.",https://www.ncbi.nlm.nih.gov/pubmed/30593744,Iranian journal of immunology : IJI,2019 04 08,"Bacteremia and sepsis are associated with high mortality, increased hospital stays, and associated costs, especially in trauma patients. Sepsis is a fatal immunological disorder and its pathophysiology is still poorly understood."
1,PrihRohra,"Department of Pathology, Rush University Medical Center, Chicago, Illinois.",,FatimaMir,"Department of Pathology, Rush University Medical Center, Chicago, Illinois.",,Diana MurroLin,"Department of Pathology, The University of Alabama, Birmingham, Alabama.",,KarinaFurlan,"Department of Pathology, Rush University Medical Center, Chicago, Illinois.",,SaraJavidiparsijani,"Loyola University Medical Center, Maywood, Illinois.",,DavidLucero,"Department of Pathology, Rush University Medical Center, Chicago, Illinois.",,PaoloGattuso,"Department of Pathology, Rush University Medical Center, Chicago, Illinois.",,AmartyaKundu,"Division of Cardiovascular Medicine, University of Massachusetts Medical School, Worcester, Massachusetts.",,ParthaSardar,"Division of Cardiovascular Medicine, Brown University, Providence, Rhode Island.",,NikolaosKakouros,"Division of Cardiovascular Medicine, University of Massachusetts Medical School, Worcester, Massachusetts.",,Role of fine-needle aspiration in post liver transplant patients: A clinical/cytological review.,https://www.ncbi.nlm.nih.gov/pubmed/30593732,Diagnostic cytopathology,2019 04 04,"Fine-needle aspiration (FNA) of superficial and deep-seated lesions has been used with high sensitivity and specificity in the diagnosis of neoplastic and nonneoplastic lesions. However, literature of FNA in posttransplant patients is sparse, especially in postliver transplant. We undertook a retrospective study to evaluate the utility of FNA in the clinical management of post liver transplant patients.",Outcomes of multivessel vs culprit lesion-only percutaneous coronary intervention in patients with acute myocardial infarction complicated by cardiogenic shock: Evidence from an updated meta-analysis.,https://www.ncbi.nlm.nih.gov/pubmed/30593731,Catheterization and cardiovascular interventions : official journal of the Society for Cardiac Angiography & Interventions,2018 12 29,"This updated meta-analysis evaluated outcomes with multi-vessel (MV-PCI) vs culprit lesion-only percutaneous coronary intervention (CL-PCI), in patients with acute myocardial infarction (AMI) complicated by cardiogenic shock (CS).",Growth of pediatric recipients after renal transplantation from small pediatric deceased donors weighing less than 15 kg.,https://www.ncbi.nlm.nih.gov/pubmed/30593730,Pediatric transplantation,2019 02 25,"RTx is currently the best treatment for children with ESRD. This study retrospectively analyzed the outcomes of growth after RTx using the pediatric-to-pediatric allocation strategy and some factors that may affect it. From March 2012 to August 2016, 8 en bloc and 38 single pediatric RTxs were performed at our center using organs from small pediatric deceased donors (weight < 15 kg). Growth before and after RTx was analyzed according to the height-for-age z-score at RTx, the 3-year follow-up, and adulthood and compared between the procedures. The chi-square test and multiple linear regression analysis were used for statistical analyses. Overall, 79.2% of children were diagnosed with chronic nephritis before RTx; 14.6% of cases were due to congenital urinary tract malformation, and 6.3% of cases were due to unknown causes. All grafts and patients survived postoperatively. The mean estimated GFRs were 92.7 ± 28.6 mL/min/1.73 m2 , 100.9 ± 32.3 mL/min/1.73 m2 , and 110.1 ± 34.8 mL/min/1.73 m2 at 1, 2, and 3 years' postoperatively, respectively. The children's postoperative growth and development, particularly during the first year postoperatively, improved but were negatively correlated with age and the height-for-age z-score before RTx. The growth of children after RTx was moderate and accelerated during prepubescence. The rate of post-RTx growth during the first year postoperatively was unrelated to the recipient's sex or duration of dialysis (P > 0.05) but was negatively correlated with age at RTx (r = -0.349, P = 0.043). Future studies on the long-term outcomes are still needed.",Survival and functionality of xeno-free human embryonic stem cell-derived retinal pigment epithelial cells on polyester substrate after transplantation in rabbits.,https://www.ncbi.nlm.nih.gov/pubmed/30593729,Acta ophthalmologica,2018 12 29,To study immunogenic properties of human embryonic stem cell-derived retinal pigment epithelium (hESC-RPE) and to evaluate subretinal xenotransplantation of hESC-RPE on porous polyethylene terephthalate (PET) in rabbits.,Long-term outcome and pattern of failure for patients with nasopharyngeal carcinoma treated with intensity-modulated radiotherapy.,https://www.ncbi.nlm.nih.gov/pubmed/30593728,Head & neck,2019 04 16,To analyze the long-term outcome and pattern of failure for patients with nasopharyngeal carcinoma (NPC) after intensity-modulated radiotherapy (IMRT).,HPLC determination of γ-aminobutyric acid and its analogs in human serum using precolumn fluorescence labeling with 4-(carbazole-9-yl)-benzyl chloroformate.,https://www.ncbi.nlm.nih.gov/pubmed/30593727,Journal of separation science,2019 02 21,"In this study, a simple analytical method for the determination of γ-aminobutyric acid, gabapentin, and baclofen by using high-performance liquid chromatography with fluorescence detection was developed. An amidogen-reactive fluorescence labeling reagent, 4-(carbazole-9-yl)-benzyl chloroformate was first used to sensitively label these analytes. The completed labeling of these analytes can be finished rapidly only within 5 min at the room temperature (25°C) to form 4-(carbazole-9-yl)-benzyl chloroformate labeled fluorescence derivatives. These labeled derivatives expressed strong fluorescence property with the maximum excitation and emission wavelengths of 280 and 380 nm, respectively. The labeled derivatives were analyzed using a reversed-phase Eclipse SB-C18 column within 10 min with satisfactory shapes. Excellent linearity (R2  > 0.995) for all analytes was achieved with the limits of detection and the limits of quantitation in the range of 0.25-0.35 and 0.70-1.10 μg/L, respectively. The proposed method was used for the simultaneous determination of γ-aminobutyric acid and its analogs in human serum with satisfactory recoveries in the range of 94.5-97.5%.","The role of chemosensory protein 10 in the detection of behaviorally active compounds in brown planthopper, Nilaparvata lugens.",https://www.ncbi.nlm.nih.gov/pubmed/30593726,Insect science,2019 02 01,"Chemosensory proteins (CSPs) play important roles in insects' chemoreception, although their specific functional roles have not been fully elucidated. In this study, we conducted the developmental expression patterns and competitive binding assay as well as knock-down assay by RNA interference both in vitro and in vivo to reveal the function of NlugCSP10 from the brown planthopper (BPH), Nilaparvata lugens (Stål), a major pest in rice plants. The results showed that NlugCSP10 messenger RNA was significantly higher in males than in females and correlated to gender, development and wing forms. The fluorescence binding assays revealed that NlugCSP10 exhibited the highest binding affinity with cis-3-hexenyl acetate, eicosane, and (+)-β-pinene. Behavioral assay revealed that eicosane displayed attractant activity, while cis-3-hexenyl acetate, similar to (+)-β-pinene significantly repelled N. lugens adults. Silencing of NlugCSP10, which is responsible for cis-3-hexenyl acetate binding, significantly disrupted cis-3-hexenyl acetate communication. Overall, findings of the present study showed that NlugCSP10 could selectively interrelate with numerous volatiles emitted from host plants and these ligands could be designated to develop slow-release mediators that attract/repel N. lugens and subsequently improve the exploration of plans to control this insect pest.",Upregulation of long noncoding RNA TUG1 by EGR1 promotes adenomyotic epithelial cell migration and invasion through recruiting EZH2 and suppressing TIMP2.,https://www.ncbi.nlm.nih.gov/pubmed/30593723,Molecular reproduction and development,2019 06 13,"Emerging studies showed that lncRNA taurine upregulated 1 (TUG1) plays important roles in diverse biological processes. However, there is no previously published research reporting the regulatory role of lncRNAs in the progression of adenomyosis. In the present study, we found that TUG1 is upregulated in human adenomyosis, and the overexpression of TUG1 is associated with the transcription factor early growth response 1 (EGR1). Functionally, the knockdown of TUG1 inhibited adenomyotic epithelial cell migration and invasion but not growth. The mechanistic experiments demonstrated that the function of TUG1 in adenomyotic epithelial cell invasion is, at least in part, through recruiting the enhancer of zeste homolog 2 (EZH2) to the promoter of tissue inhibitor of metalloproteinases 2 (TIMP2) and negatively regulating its expression. Our study demonstrated that TUG1 promotes the migration and invasion of human adenomyotic epithelial cells, and EGR1/TUG1/EZH2/TIMP2 may be a potential therapeutic target for adenomyosis.","Rates and pathways of CH4 oxidation in ferruginous Lake Matano, Indonesia.",https://www.ncbi.nlm.nih.gov/pubmed/30593722,Geobiology,2019 04 26,"This study evaluates rates and pathways of methane (CH4 ) oxidation and uptake using 14 C-based tracer experiments throughout the oxic and anoxic waters of ferruginous Lake Matano. Methane oxidation rates in Lake Matano are moderate (0.36 nmol L-1  day-1 to 117 μmol L-1  day-1 ) compared to other lakes, but are sufficiently high to preclude strong CH4 fluxes to the atmosphere. In addition to aerobic CH4 oxidation, which takes place in Lake Matano's oxic mixolimnion, we also detected CH4 oxidation in Lake Matano's anoxic ferruginous waters. Here, CH4 oxidation proceeds in the apparent absence of oxygen (O2 ) and instead appears to be coupled to some as yet uncertain combination of nitrate ( <mml:math xmlns:mml=""http://www.w3.org/1998/Math/MathML""><mml:msubsup><mml:mtext>NO</mml:mtext> <mml:mrow><mml:mn>3</mml:mn></mml:mrow> <mml:mo>-</mml:mo></mml:msubsup> </mml:math> ), nitrite ( <mml:math xmlns:mml=""http://www.w3.org/1998/Math/MathML""><mml:msubsup><mml:mtext>NO</mml:mtext> <mml:mrow><mml:mn>2</mml:mn></mml:mrow> <mml:mo>-</mml:mo></mml:msubsup> </mml:math> ), iron (Fe) or manganese (Mn), or sulfate ( <mml:math xmlns:mml=""http://www.w3.org/1998/Math/MathML""><mml:msubsup><mml:mtext>SO</mml:mtext> <mml:mrow><mml:mn>4</mml:mn></mml:mrow> <mml:mrow><mml:mn>2</mml:mn> <mml:mo>-</mml:mo></mml:mrow> </mml:msubsup> </mml:math> ) reduction. Throughout the lake, the fraction of CH4 carbon that is assimilated vs. oxidized to carbon dioxide (CO2 ) is high (up to 93%), indicating extensive CH4 conversion to biomass and underscoring the importance of CH4 as a carbon and energy source in Lake Matano and potentially other ferruginous or low productivity environments.",Detection of visual field defects by opticians - with Damato Multifixation Campimetry Online.,https://www.ncbi.nlm.nih.gov/pubmed/30593721,Acta ophthalmologica,2018 12 29,"To study Damato Multifixation Campimetry Online (DMCO), an inexpensive online visual field test, used for screening at optician shops in Denmark."
