Page number,Author Name,Author affiliation,Email,Co-author 1 Name,Co-author 1 Affiliation,Co-author 1 Email,Co-author 2 Name,Co-author 2 Affiliation,Co-author 2 Email,Co-author 3 Name,Co-author 3 Affiliation,Co-author 3 Email,Co-author 4 Name,Co-author 4 Affiliation,Co-author 4 Email,Co-author 5 Name,Co-author 5 Affiliation,Co-author 5 Email,Co-author 6 Name,Co-author 6 Affiliation,Co-author 6 Email,Co-author 7 Name,Co-author 7 Affiliation,Co-author 7 Email,Co-author 8 Name,Co-author 8 Affiliation,Co-author 8 Email,Co-author 9 Name,Co-author 9 Affiliation,Co-author 9 Email,Article 1 Title,Article 1 URL,Article 1 Journal,Article 1 Pub Date,Article 1 Abstract,Article 2 Title,Article 2 URL,Article 2 Journal,Article 2 Pub Date,Article 2 Abstract,Article 3 Title,Article 3 URL,Article 3 Journal,Article 3 Pub Date,Article 3 Abstract,Article 4 Title,Article 4 URL,Article 4 Journal,Article 4 Pub Date,Article 4 Abstract,Article 5 Title,Article 5 URL,Article 5 Journal,Article 5 Pub Date,Article 5 Abstract,Article 6 Title,Article 6 URL,Article 6 Journal,Article 6 Pub Date,Article 6 Abstract,Article 7 Title,Article 7 URL,Article 7 Journal,Article 7 Pub Date,Article 7 Abstract,Article 8 Title,Article 8 URL,Article 8 Journal,Article 8 Pub Date,Article 8 Abstract,Article 9 Title,Article 9 URL,Article 9 Journal,Article 9 Pub Date,Article 9 Abstract,Article 10 Title,Article 10 URL,Article 10 Journal,Article 10 Pub Date,Article 10 Abstract
0,Patricia JHollen,"School of Nursing, University of Virginia, Charlottesville, Virginia.",,Mary COʼLaughlen,"School of Nursing, University of Virginia, Charlottesville, Virginia.",,Martha AHellems,"School of Medicine, University of Virginia.",,Ivora DHinton,"Data Analyses and Interpretation, School of Nursing, University of Virginia.",,WenjunXin,"Department of Public Health Sciences, University of Virginia.",,James TPatrie,"Department of Public Health Sciences, University of Virginia.",,Elizabeth KKuzma,"Department of Health Behavior and Biological Sciences, School of Nursing, University of Michigan, Ann Arbor, Michigan.",,ChristieGraziano,"Plainwell, Michigan.",,ElizabethShea,"Ann Arbor, Michigan.",,Franklin VSchaller,"College of Health and Human Services, School of Nursing, Eastern Michigan University, Ypsilanti, Michigan.",,Comparison of two cohorts of medically at-risk adolescents engaging in substance use (asthmatics and cancer survivors): Clinical predictors for monitoring care.,https://www.ncbi.nlm.nih.gov/pubmed/31169784,Journal of the American Association of Nurse Practitioners,2019 06 06,"Medically at-risk adolescents differ in their perception of severity and are vulnerable to substance use because of effects on their medical regimen. The intent in comparing two cohorts, adolescent survivors of cancer and teens with asthma, is to provide clinical predictors to help in monitoring those needing help with substance use decision making.","Improving lesbian, gay, bisexual, transgender, and queer/questioning health: Using a standardized patient experience to educate advanced practice nursing students.",https://www.ncbi.nlm.nih.gov/pubmed/31169783,Journal of the American Association of Nurse Practitioners,2019 06 06,"Lesbian, gay, bisexual, transgender, and queer/questioning (LGBTQ) persons account for 3.5% of the population. Nursing programs in the United States provide a median of 2.13 hours of formal content regarding LGBTQ health, which contributes to iatrogenic barriers to care. Patient experiences related to inadequate provider preparation include misguided treatment strategies, impedance of communication, and abuse. A pilot educational project was developed to provide advanced practice nursing (APRN) students meaningful clinical interactions with LGBTQ-identifying standardized patients (SPs) to better prepare them to care for LGBTQ patients with cultural humility. This project was determined to be Exempt by the Institutional Review Board at the University of Michigan. Implemented in an advanced health assessment course with 99 APRN students, components of the project included course readings, lecture content, laboratory activities, an SP experience, and both large and small debriefing sessions. The SP experience itself was a 15-minute clinical encounter with a patient presenting with ""abdominal pain,"" with an emphasis on history-taking, communication, and cultural humility. Qualitative data analysis was performed using the constant comparison method to interpret the results from student evaluations and other written feedback. This pilot project has promise to inform future educational offerings and set the standard for LGBTQ health content and application for APRN students. Further research is needed to evaluate the quality of LGBTQ content in APRN curricula to improve the ability of APRN students to provide care to LGBTQ patients.",Use of Music Lyrics to Engage Millennial Learners in Undergraduate Research.,https://www.ncbi.nlm.nih.gov/pubmed/31169782,Nursing education perspectives,2019 06 06,"Undergraduate research, a high-impact learning practice, peaks interest and enthusiasm for research and contributes to development of research process knowledge, skills, and competency. Fifty millennial sophomore nursing students participated in the innovative learning activity using lyrics from popular songs to complete qualitative analysis in a research course. Students analyzed, synthesized, and developed themes from music lyrics that helped them to more fully understand the processes and perspectives of qualitative research. This activity taught students about qualitative research and provided an opportunity to develop analysis, synthesis, and teamwork knowledge and skills transferable to the professional environment.",Using High-Fidelity Simulation to Evaluate Clinical Skills in Prelicensure Nursing Students.,https://www.ncbi.nlm.nih.gov/pubmed/31169781,Nursing education perspectives,2019 06 06,"A prelicensure associate degree nursing program identified the need to formally validate clinical skills and decision-making within nursing students across the program and implemented a process using high-fidelity simulation. The simulated experiences provided an opportunity for both formative and summative evaluation while also affording an opportunity to level student performance across the program. Faculty reported improved consistency in their expectations of student performance within each nursing course, and students reported improved confidence in their clinical practice skills.",Competence-Based Curriculum Development in Nursing Education: A Story From the Western Balkans.,https://www.ncbi.nlm.nih.gov/pubmed/31169780,Nursing education perspectives,2019 06 06,"This article describes the process of competence-based curriculum development in nursing education at Western Balkan (WB) universities. Nursing education in the WB has been noncompliant with the standard educational approaches of the European Union's directive on regulated professions. The overall aim of the TEMPUS project ""Competency-Based Curriculum Reform in Nursing and Caring in Western Balkan Universities"" was to bring curricular reform for bachelor's nursing education in the WB region in line with competence-based education and professional standards to demonstrate compliance with all member countries of the European Union.",Gender Differences and Similarities in Accelerated Nursing Education Programs: Evidence of Success From the New Careers in Nursing Program.,https://www.ncbi.nlm.nih.gov/pubmed/31169779,Nursing education perspectives,2019 06 06,"The aim of the study was to examine the profile of male students in accelerated nursing education programs (ANEPs) focusing on key demographic, educational, and outcome variables and compare male and female students on these variables.",The Impact of Positive Space Training on Students' Communication With LGBTTQ+ Communities.,https://www.ncbi.nlm.nih.gov/pubmed/31169778,Nursing education perspectives,2019 06 06,"The lesbian, gay, bisexual, transgender, two-spirit, and queer (LGBTTQ+) communities have experienced discrimination from nurses and other health care professionals, resulting in health inequity. The purpose of this study was to examine the impact of positive space training on students' knowledge and comfort level with LGBTTQ+ communities. A quasi-experimental study with surveys and focus groups was conducted with 160 students. All participants perceived an increase in knowledge and comfort in communicating with LGBTTQ+ people after training. Positive space training can be part of the bank of learning strategies we offer students to increase their knowledge and comfort when interacting with LGBTTQ+ communities.",Effectiveness of non-pharmacological and non-surgical interventions for rheumatoid arthritis: an umbrella review.,https://www.ncbi.nlm.nih.gov/pubmed/31169776,JBI database of systematic reviews and implementation reports,2019 06 06,This umbrella review aimed to determine the effectiveness of non-pharmacological and non-surgical interventions on the impact of rheumatoid arthritis.,Respite care for children and youth with complex care needs and their families: a scoping review protocol.,https://www.ncbi.nlm.nih.gov/pubmed/31169775,JBI database of systematic reviews and implementation reports,2019 06 06,"The objective of this scoping review is to identify and characterize interventions, programs or models used to deliver respite care services to children and youth with complex care needs and their families.",School-based obesity prevention programs in rural communities: a scoping review protocol.,https://www.ncbi.nlm.nih.gov/pubmed/31169774,JBI database of systematic reviews and implementation reports,2019 06 06,The objective of this scoping review is to map the available literature on school-based obesity prevention programs in rural communities.
1,VenuAmula,"Department of Pediatrics, University of Utah, Salt Lake City, UT.",,David FVener,"Department of Pediatric Anesthesia, Pediatric Cardiac Anesthesia, Texas Children's Hospital, Baylor College of Medicine, Houston, TX.",,Charles GPribble,"Department of Pediatrics, University of Utah, Salt Lake City, UT.",,LoriRiegger,"Department of Anesthesia, University of Michigan, Ann Arbor, MI.",,Elizabeth CWilson,"Department of Anesthesia, Emory University, Children's Healthcare of Atlanta, Atlanta, GA.",,Lara SShekerdemian,"Department of Pediatrics, Texas Children's Hospital, Baylor College of Medicine, Houston, TX.",,ZhiningOu,"Division of Epidemiology, Department of Internal Medicine, University of Utah, Salt Lake City, UT.",,Angela PPresson,"Division of Epidemiology, Department of Internal Medicine, University of Utah, Salt Lake City, UT.",,Madolin KWitte,"Department of Pediatrics, University of Utah, Salt Lake City, UT.",,Susan CNicolson,"Department of Anesthesiology and Critical Care Medicine, Children's Hospital of Philadelphia, Philadelphia, PA.",,Changes in Anesthetic and Postoperative Sedation-Analgesia Practice Associated With Early Extubation Following Infant Cardiac Surgery: Experience From the Pediatric Heart Network Collaborative Learning Study.,https://www.ncbi.nlm.nih.gov/pubmed/31169762,Pediatric critical care medicine : a journal of the Society of Critical Care Medicine and the World Federation of Pediatric Intensive and Critical Care Societies,2019 06 10,The Pediatric Heart Network sponsored the multicenter Collaborative Learning Study that implemented a clinical practice guideline to facilitate early extubation in infants after repair of isolated coarctation of the aorta and tetralogy of Fallot. We sought to compare the anesthetic practice in the operating room and sedation-analgesia management in the ICU before and after the implementation of the guideline that resulted in early extubation.,Ventricular-Arterial Coupling in Children and Infants With Congenital Heart Disease After Cardiopulmonary Bypass Surgery: Observational Study.,https://www.ncbi.nlm.nih.gov/pubmed/31169761,Pediatric critical care medicine : a journal of the Society of Critical Care Medicine and the World Federation of Pediatric Intensive and Critical Care Societies,2019 06 06,Ventricular-arterial coupling represents the interaction between the left ventricle and the arterial system. Ventricular-arterial coupling is measured as the ratio between arterial elastance and ventricular end-systolic elastance. Scant information is available in critically ill children about these variables. The aim of this study was to prospectively assess ventricular-arterial coupling after pediatric cardiac surgery and evaluate its association with other commonly recorded hemodynamic parameters.,Quality Assessment of Dried Blood Spots from Tuberculosis Patients from Four Countries.,https://www.ncbi.nlm.nih.gov/pubmed/31169760,Therapeutic drug monitoring,2019 06 06,"Dried blood spot (DBS) sampling is a blood collection tool that uses a finger prick to obtain a blood drop on a dried blood spot card. It can be used for therapeutic drug monitoring, a method that uses blood drug concentrations to optimize individual treatment. DBS sampling is thought to be a simpler way of blood collection compared to venous sampling. The aim of this study was to evaluate the quality of dried blood spots from tuberculosis patients all around the world based on quality indicators in a structured assessment procedure.",Grand Round: Reversible impaired methotrexate clearance after platinum-based chemotherapy for osteosarcoma.,https://www.ncbi.nlm.nih.gov/pubmed/31169759,Therapeutic drug monitoring,2019 06 06,"The authors present a case of an 18-year old male with metastasized osteosarcoma, admitted for methotrexate (MTX) treatment combined with cisplatin and doxorubicin. During the first cycle, severe MTX toxicity was observed with increased MTX serum levels and delayed MTX clearance requiring rescue treatment with intensified leucovorin. In the following cycles, cisplatin and doxorubicin were discontinued and MTX dose was reduced. The elimination half-life slowly improved over the following cycles suggesting a reversible cause responsible for reduced MTX clearance and toxicity during the first cycle. Cisplatin is well-known for its nephrotoxic effects and can induce reversible tubular injury. Prior treatment with cisplatin may well have been responsible for decreased MTX clearance and combination treatment should be used with adequate monitoring of MTX levels. Other factors that may have contributed, such as urine alkalization, gene polymorphisms, and other drug-drug interactions are discussed.",A Comprehensive Analysis of Liver Transplantation Outcomes Among Ethnic Minorities in the United States.,https://www.ncbi.nlm.nih.gov/pubmed/31169758,Journal of clinical gastroenterology,2019 06 06,The aim of this study was to perform a comprehensive assessment of liver transplant (LT) outcomes among US adults with a specific focus on understanding race/ethnicity-specific disparities.,Recent Advances in Cognitive Behavioral Therapy For Digestive Disorders and the Role of Applied Positive Psychology Across the Spectrum of GI Care.,https://www.ncbi.nlm.nih.gov/pubmed/31169757,Journal of clinical gastroenterology,2019 06 06,"Although cognitive behavior therapies (CBTs) have shown great promise in the reduction of symptom burden from as well as anxiety around various gastrointestinal (GI) disorders, there are substantial issues involving the scalable delivery of such interventions within the clinical setting of a gastroenterology practice, leaving most patients without access to psychological care.",Nurse Residency Programs: Key Components for Sustainability.,https://www.ncbi.nlm.nih.gov/pubmed/31169756,Journal for nurses in professional development,2019 06 06,"The purpose of this integrative literature review was to identify commonalities among nurse residency programs deployed for greater than 3 years, showing improved job retention and satisfaction. The Johns Hopkins Nursing Evidence-Based Practice Model guided this review. Successful, sustainable nurse residency programs have a strong foundation with committed leadership to support transition; a structured program with defined outcomes to promote clinical competence, safe patient care, and professional development; and an evaluation process to guide continual improvement and meet organizational needs.",Double Versus Single Tendon Transfers to Improve Shoulder Function in Brachial Plexus Birth Palsy.,https://www.ncbi.nlm.nih.gov/pubmed/31169755,Journal of pediatric orthopedics,2019 06 06,"In children with brachial plexus birth palsy (BPBP) undergoing tendon transfers to augment shoulder external rotation, it is unclear whether transfer of the latissimus dorsi with its combined latissimus dorsi and teres major (cLT) versus isolated teres major (iTM) tendon transfer yield different outcomes.",Time to Return to School After 10 Common Orthopaedic Surgeries Among Children and Adolescents.,https://www.ncbi.nlm.nih.gov/pubmed/31169754,Journal of pediatric orthopedics,2019 06 06,Return to school among adolescents is often overlooked in orthopaedic outcome studies. The purpose was to measure the time missed from school after 10 common orthopedic surgeries.,Clubfoot and Tethered Cord Syndrome: Results of Treatment With the Ponseti Method.,https://www.ncbi.nlm.nih.gov/pubmed/31169753,Journal of pediatric orthopedics,2019 06 06,The Ponseti technique has demonstrated high success rates worldwide for the treatment of idiopathic clubfoot. The purpose of this study was to determine whether clubfoot associated with tethered cord syndrome (TCS) was more resistant to Ponseti treatment than isolated clubfoot.
