Page number,Author Name,Author affiliation,Email,Co-author 1 Name,Co-author 1 Affiliation,Co-author 1 Email,Co-author 2 Name,Co-author 2 Affiliation,Co-author 2 Email,Co-author 3 Name,Co-author 3 Affiliation,Co-author 3 Email,Co-author 4 Name,Co-author 4 Affiliation,Co-author 4 Email,Co-author 5 Name,Co-author 5 Affiliation,Co-author 5 Email,Co-author 6 Name,Co-author 6 Affiliation,Co-author 6 Email,Co-author 7 Name,Co-author 7 Affiliation,Co-author 7 Email,Co-author 8 Name,Co-author 8 Affiliation,Co-author 8 Email,Co-author 9 Name,Co-author 9 Affiliation,Co-author 9 Email,Article 1 Title,Article 1 URL,Article 1 Journal,Article 1 Pub Date,Article 1 Abstract,Article 2 Title,Article 2 URL,Article 2 Journal,Article 2 Pub Date,Article 2 Abstract,Article 3 Title,Article 3 URL,Article 3 Journal,Article 3 Pub Date,Article 3 Abstract,Article 4 Title,Article 4 URL,Article 4 Journal,Article 4 Pub Date,Article 4 Abstract,Article 5 Title,Article 5 URL,Article 5 Journal,Article 5 Pub Date,Article 5 Abstract,Article 6 Title,Article 6 URL,Article 6 Journal,Article 6 Pub Date,Article 6 Abstract,Article 7 Title,Article 7 URL,Article 7 Journal,Article 7 Pub Date,Article 7 Abstract,Article 8 Title,Article 8 URL,Article 8 Journal,Article 8 Pub Date,Article 8 Abstract,Article 9 Title,Article 9 URL,Article 9 Journal,Article 9 Pub Date,Article 9 Abstract,Article 10 Title,Article 10 URL,Article 10 Journal,Article 10 Pub Date,Article 10 Abstract
0,EdoardoIsnaldi,"Department of Internal Medicine (Di.M.I.), University of Genoa, Viale Benedetto XV, 6, 16132, Genoa, Italy.",,AnnaGaruti,"Department of Internal Medicine (Di.M.I.), University of Genoa, Viale Benedetto XV, 6, 16132, Genoa, Italy.",,GabriellaCirmena,"Department of Internal Medicine (Di.M.I.), University of Genoa, Viale Benedetto XV, 6, 16132, Genoa, Italy.",,StefanoScabini,"Department of Integrated Surgical and Diagnostic Sciences (DISC), University of Genoa, Genoa, Italy.",,EdoardoRimini,"Department of Integrated Surgical and Diagnostic Sciences (DISC), University of Genoa, Genoa, Italy.",,LorenzoFerrando,"Department of Internal Medicine (Di.M.I.), University of Genoa, Viale Benedetto XV, 6, 16132, Genoa, Italy.",,MichelaLia,"Department of Internal Medicine (Di.M.I.), University of Genoa, Viale Benedetto XV, 6, 16132, Genoa, Italy.",,RobertoMurialdo,"Ospedale Policlinico San Martino IRCCS Per l'Oncologia, Genoa, Italy.",,LuciaTixi,"Ospedale Policlinico San Martino IRCCS Per l'Oncologia, Genoa, Italy.",,EnricoCarminati,"Department of Internal Medicine (Di.M.I.), University of Genoa, Viale Benedetto XV, 6, 16132, Genoa, Italy.",,Clinico-pathological associations and concomitant mutations of the RAS/RAF pathway in metastatic colorectal cancer.,https://www.ncbi.nlm.nih.gov/pubmed/31036005,Journal of translational medicine,2019 06 10,"Over the past few years, next-generation sequencing (NGS) has become reliable and cost-effective, and its use in clinical practice has become a reality. A relevant role for NGS is the prediction of response to anti-EGFR agents in metastatic colorectal cancer (mCRC), where multiple exons from KRAS, NRAS, and BRAF must be sequenced simultaneously.",To what extent is Fetal Alcohol Spectrum Disorder considered in policy-related documents in South Africa? A document review.,https://www.ncbi.nlm.nih.gov/pubmed/31036004,Health research policy and systems,2019 06 10,"South Africa is considered to have the highest prevalence of fetal alcohol spectrum disorder (FASD) globally. Nevertheless, the extent to which the South African government has responded to the high FASD prevalence at the policy level is unclear. Herein, we aimed to identify targeted and generic clauses that could be attributed to the prevention and management of FASD in relevant South African policy documents.","Technology-aided assessments of sensorimotor function: current use, barriers and future directions in the view of different stakeholders.",https://www.ncbi.nlm.nih.gov/pubmed/31036003,Journal of neuroengineering and rehabilitation,2019 06 10,"There is growing interest in the use of technology in neurorehabilitation, from robotic to sensor-based devices. These technologies are believed to be excellent tools for quantitative assessment of sensorimotor ability, addressing the shortcomings of traditional clinical assessments. However, clinical adoption of technology-based assessments is very limited. To understand this apparent contradiction, we sought to gather the points-of-view of different stakeholders in the development and use of technology-aided sensorimotor assessments.",Measuring implementation in global mental health: validation of a pragmatic implementation science measure in eastern Ukraine using an experimental vignette design.,https://www.ncbi.nlm.nih.gov/pubmed/31036002,BMC health services research,2019 06 10,"There is mounting evidence supporting the effectiveness of task-shifted mental health interventions in low- and middle-income countries (LMIC). However, there has been limited systematic scale-up or sustainability of these programs, indicating a need to study implementation. One barrier to progress is a lack of locally relevant and valid implementation measures. We adapted an existing brief dissemination and implementation (D&I) measure which includes scales for acceptability, appropriateness, feasibility and accessibility for local use and studied its validity and reliability among a sample of consumers in Ukraine.",Papaver nudicaule (Iceland poppy) alleviates lipopolysaccharide-induced inflammation through inactivating NF-κB and STAT3.,https://www.ncbi.nlm.nih.gov/pubmed/31036001,BMC complementary and alternative medicine,2019 06 10,"Papaver nudicaule belongs to the Papaveraceae family, which is planted as an annual herbaceous species generally for ornamental purpose. Papaver rhoeas in the same family has been reported to have various pharmacological activities such as antioxidant and analgesic effects. In contrast, little is known about the pharmacological activity of Papaver nudicaule. In this study, the anti-inflammatory activity of Papaver nudicaule extracts and the action mechanisms were investigated in RAW264.7 macrophage cells.",A quality indicator set for use in rehabilitation team care of people with rheumatic and musculoskeletal diseases; development and pilot testing.,https://www.ncbi.nlm.nih.gov/pubmed/31036000,BMC health services research,2019 06 10,Systems for monitoring effectiveness and quality of rehabilitation services across health care levels are needed. The purpose of this study was to develop and pilot test a quality indicator set for rehabilitation of rheumatic and musculoskeletal diseases.,Plasmodium knowlesi clinical isolates from Malaysia show extensive diversity and strong differential selection pressure at the merozoite surface protein 7D (MSP7D).,https://www.ncbi.nlm.nih.gov/pubmed/31035999,Malaria journal,2019 06 10,"The high proportion of human cases due to the simian malaria parasite Plasmodium knowlesi in Malaysia is a cause of concern, as they can be severe and even fatal. Merozoite surface protein 7 (MSP7) is a multigene family which forms a non-covalent complex with MSP-1 prior to receptor-ligand recognition in Plasmodium falciparum and thus an important antigen for vaccine development. However, no study has been done in any of the ortholog family members in P. knowlesi from clinical samples. This study investigates the level of polymorphism, haplotypes, and natural selection acting at the pkmsp-7D gene in clinical samples from Malaysia.",Elevated plasma copeptin levels identify the presence and severity of non-alcoholic fatty liver disease in obesity.,https://www.ncbi.nlm.nih.gov/pubmed/31035998,BMC medicine,2019 06 10,"Copeptin is the stable surrogate marker of vasopressin (VP), which is released in response to elevated plasma osmolality or low blood pressure. Elevated plasma copeptin levels are associated with higher risk of insulin resistance-related disorders, such as type 2 diabetes (T2DM), metabolic syndrome (MS), and cardiovascular disease, and experimental reduction of circulating VP levels is shown to significantly decrease hepatic fat content in obese rats, independently from body adiposity. However, the association between copeptin and non-alcoholic fatty liver disease and steatohepatitis (NAFLD/NASH) in humans has not been explored yet. The aim of this study was to explore the relationship between plasma copeptin and the presence/severity of NAFLD/NASH.",Health service brokerage to improve primary care access for populations experiencing vulnerability or disadvantage: a systematic review and realist synthesis.,https://www.ncbi.nlm.nih.gov/pubmed/31035997,BMC health services research,2019 06 10,"Individuals experiencing disadvantage or marginalisation often face difficulty accessing primary health care. Overcoming access barriers is important for improving the health of these populations. Brokers can empower and enable people to access resources; however, their role in increasing access to health services has not been well-defined or researched in the literature. This review aims to identify whether a health service broker working with health and social service providers in the community can (a) identify individuals experiencing vulnerability who may benefit from improved access to quality primary care, and (b) link these individuals with an appropriate primary care provider for enduring, appropriate primary care.",Subxiphoid vs transthoracic approach thoracoscopic surgery for spontaneous pneumothorax: a propensity score-matched analysis.,https://www.ncbi.nlm.nih.gov/pubmed/31035996,BMC surgery,2019 06 10,"The transthoracic thoracoscopic surgery is currently accepted as a favorable technique for bullectomy for primary spontaneous pneumothorax. Recently, uniportal subxiphoid thoracoscopic surgery has been proposed as an alternative to conventional transthoracic thoracoscopic surgery."
1,IssahakuSulley,"Department of Nutritional Sciences, School of Allied Health Sciences, University for Development Studies, P O Box 1883, Tamale, Ghana.",,Abdul-RazakAbizari,"Department of Nutritional Sciences, School of Allied Health Sciences, University for Development Studies, P O Box 1883, Tamale, Ghana. abizaria@yahoo.com.",abizaria@yahoo.com,ZakariAli,"Department of Nutritional Sciences, School of Allied Health Sciences, University for Development Studies, P O Box 1883, Tamale, Ghana.",,WisdomPeprah,"Department of Nutritional Sciences, School of Allied Health Sciences, University for Development Studies, P O Box 1883, Tamale, Ghana.",,Hamshawu GombillaYakubu,"Department of Nutritional Sciences, School of Allied Health Sciences, University for Development Studies, P O Box 1883, Tamale, Ghana.",,Wilfred WForfoe,"Impact Malaria Project, 14 Ollenu Street, East Legon, PMB 18, Accra, Ghana.",,MahamaSaaka,"Department of Nutritional Sciences, School of Allied Health Sciences, University for Development Studies, P O Box 1883, Tamale, Ghana.",,EricWobudeya,"Directorate of Pediatrics & Child Health, Mulago National Referral Hospital, P.O. Box 23491, Kampala, Uganda. ewobudeya@gmail.com.",ewobudeya@gmail.com,DevanJaganath,"Division of Pediatric Infectious Diseases, University of California, 550 16th St. 4th floor, San Francisco, CA, 94158, USA.",,Moorine PenninahSekadde,"National TB and Leprosy Program (NTLP), Plot 6, Lourdel Road, Nakasero, P. O. Box 7272, Kampala, Uganda.",,Growth monitoring and promotion practices among health workers may be suboptimal despite high knowledge scores.,https://www.ncbi.nlm.nih.gov/pubmed/31035985,BMC health services research,2019 06 10,"The child health record booklet (CHRB) is a powerful tool for screening children under five and for education of caregivers by health workers. The objective of the present study was to assess the knowledge and utilization of CHRB by mothers and health workers in child growth monitoring and promotion (GMP) in the East Mamprusi Municipal, Northern region, Ghana.","Outcomes of empiric treatment for pediatric tuberculosis, Kampala, Uganda, 2010-2015.",https://www.ncbi.nlm.nih.gov/pubmed/31035984,BMC public health,2019 06 10,"Childhood tuberculosis (TB) diagnoses often lack microbiologic confirmation and require empiric treatment. Barriers to empiric treatment include concern for poor outcomes and adverse effects. We thus determined the outcomes of empiric TB treatment from a retrospective cohort of children at a national referral hospital in Kampala, Uganda from 2010 to 2015.","Strengthening referral systems in community health programs: a qualitative study in two rural districts of Maputo Province, Mozambique.",https://www.ncbi.nlm.nih.gov/pubmed/31035983,BMC health services research,2019 06 10,Effective referral systems from the community to the health care facility are essential to save lives and ensure quality and a continuum of care. The effectiveness of referral systems in Mozambique depends on multiple factors that involve three main stakeholders: clients/community members; community health workers (CHWs); and facility-based health care workers. Each stakeholder is dependent on the other and could form either a barrier or a facilitator of referral within the complex health system of Mozambique.,Mutagenesis of FAD2 genes in peanut with CRISPR/Cas9 based gene editing.,https://www.ncbi.nlm.nih.gov/pubmed/31035982,BMC biotechnology,2019 06 10,"Increasing the content of oleic acid in peanut seeds is one of the major goals in peanut breeding due to consumer and industry benefits, such as anti-oxidation and long shelf-life. Homeologous ahFAD2A and ahFAD2B genes encode fatty acid desaturases, which are the key enzymes for converting oleic acid to linoleic acid that oxidizes readily. To date, all high oleic acid peanut varieties result from natural mutations occurred in both genes. A method to induce mutations in the genes of other elite cultivars could speed introgression of this valuable trait. The gene-editing approach utilizing CRISPR/Cas9 technology was employed to induce de novo mutations in the ahFAD2 genes using peanut protoplasts and hairy root cultures as models.",Is hysterectomy beneficial in radical cystectomy for female patient with urothelial carcinoma of bladder? A retrospective analysis of consecutive 112 cases from a single institution.,https://www.ncbi.nlm.nih.gov/pubmed/31035981,BMC urology,2019 06 10,There is no criterion for determining whether female patients operated with cystectomy would benefit from hysterectomy. This study compares the oncological outcomes between female patients receiving uterus preserving cystectomy (UPC) and uterus excision cystectomy (UEC).,Vasitis: a rare diagnosis mimicking inguinal hernia: a case report.,https://www.ncbi.nlm.nih.gov/pubmed/31035980,BMC urology,2019 06 10,"Vasitis or inflammation of the vas deferens is a rare condition, and few case reports with computed tomography images have been published since 1980.",Human resource technology disruptions and their implications for human resources management in healthcare organizations.,https://www.ncbi.nlm.nih.gov/pubmed/31035979,BMC health services research,2019 06 10,"Concern among the public and policymakers about current and future major staff shortages is increasing. Strengthening Human Resource (HR) practices and adopting HR technologies such as Human Resource Information Systems (HRIS), that can collect, store and report workforce data are often described as a potential solution to this problem. Indeed, examples from other industries show that HRIS can help to launch or manage, as well as provide ongoing insights concerning the whole career cycle of an employee. However, few of the existing studies that discuss technology or its impacts on the future of work have focused on health organizations, and those that do have not received sufficient attention in health literature. Furthermore, such contributions as there have been have either prioritized a particular type of technology or focused mainly on the effect of automation on health professionals' work. They have thus overlooked the full range of possible uses of these technologies and, specifically, have neglected the topic of HR for Health (HRH) management in health organizations. The primary aim of this paper is to address this lacuna, with specific reference to the existing categorization of HR technological disruptions. To conclude, health organizations and the health and HR professionals who work within them need to use HRIS responsibly, finding a balance between the drive for innovation, productivity and efficiency and respect for all potential legal, ethical and compliance issues, as well as taking account of the importance of HRH wellbeing and satisfaction.",The use of self-management strategies for problem gambling: a scoping review.,https://www.ncbi.nlm.nih.gov/pubmed/31035978,BMC public health,2019 06 10,"Problem gambling (PG) is a serious public health concern that disproportionately affects people experiencing poverty, homelessness, and multimorbidity including mental health and substance use concerns. Little research has focused on self-help and self-management in gambling recovery, despite evidence that a substantial number of people do not seek formal treatment. This study explored the literature on PG self-management strategies. Self-management was defined as the capacity to manage symptoms, the intervention, health consequences and altered lifestyle that accompanies a chronic health concern.",Health-related quality of life as predictor of mortality in end-stage renal disease patients: an observational study.,https://www.ncbi.nlm.nih.gov/pubmed/31035977,BMC nephrology,2019 06 10,"Health-related quality of life (HRQoL) is an important component of patient-centered outcomes and a useful parameter for monitoring quality of care. We assessed HRQoL, its determinants, and associations with mortality in patients with end-stage renal disease (ESRD).","Assessing core, e-learning, clinical and technology readiness to integrate telemedicine at public health facilities in Uganda: a health facility - based survey.",https://www.ncbi.nlm.nih.gov/pubmed/31035976,BMC health services research,2019 06 10,"In developing countries like Uganda, there are shortages of health workers especially medical specialists. The referral process is frustrating to both patients and health workers (HWs). This is due to delays in accessing laboratory results/tests, costs of travel with resultant delay in consulting specialists. Telemedicine can help reduce these problems. To facilitate successful and sustainable telemedicine implementation the eHealth readiness of different stakeholders should be undertaken. This study was conducted at public health facilities (HFs) in Uganda to assess eHealth readiness across four domains; core, e-learning, clinical and technology, that might hamper adoption and integration of telemedicine."
2,AnnaTorres,"Laboratory of Biostructure, Chair of Human Anatomy, Medical University of Lublin, Lublin, Poland. anna.torres@wp.pl.",anna.torres@wp.pl,MałgorzataPac-Sosińska,"Laboratory of Biostructure, Chair of Human Anatomy, Medical University of Lublin, Lublin, Poland.",,KrzysztofWiktor,"Laboratory of Diagnostic Procedures, Medical University of Lublin, Lublin, Poland.",,TomaszPaszkowski,"III Chair and Department of Gynaecology, Medical University of Lublin, Lublin, Poland.",,RyszardMaciejewski,"Laboratory of Biostructure, Chair of Human Anatomy, Medical University of Lublin, Lublin, Poland.",,KamilTorres,"Laboratory of Biostructure, Chair of Human Anatomy, Medical University of Lublin, Lublin, Poland.",,NichlasHovmand,"Department of Infectious Diseases, Copenhagen University Hospital, Hvidovre, Denmark. nichlashovmand@me.com.",nichlashovmand@me.com,SarahByberg,"Department of Endocrinology, Copenhagen University Hospital, Hvidovre, Denmark.",,Morten BoLarsen,"Department of Orthopedics, Copenhagen University Hospital, Hvidovre, Denmark.",,DariaPodlekareva,"Department of Infectious Diseases, Copenhagen University Hospital, Rigshospitalet, Denmark.",,"CD44, TGM2 and EpCAM as novel plasma markers in endometrial cancer diagnosis.",https://www.ncbi.nlm.nih.gov/pubmed/31035965,BMC cancer,2019 06 10,"Endometrial cancer (EC) is the most common malignancy of the female reproductive tract. Despite years of research, the accurate screening strategy is still not available in this disease and it is usually diagnosed only after the clinical signs are present. The recent technological advances in analytical methodologies enabled detection of multiple molecules in one, small sample of biological materials. Such approach was undertaken in the presented study.",Necrotizing fasciitis and meningitis due to Streptococcus pneumoniae serotype 9 N: a case report.,https://www.ncbi.nlm.nih.gov/pubmed/31035964,BMC infectious diseases,2019 06 10,Necrotizing fasciitis is a deep infection of the fascia and subcutaneous tissue with a high mortality rate. Meningitis is an infection of the membranes surrounding the brain with a likewise high mortality rate. Streptococcus pneumoniae is the most frequent cause of bacterial meningitis and it is an extremely rare cause of necrotizing fasciitis. Different subcapsular serotypes of S. pneumoniae are known to have diverse virulence. The serotype 9 N is associated with a high risk of death.,A retrospective analysis of determinants of involuntary psychiatric in-patient treatment.,https://www.ncbi.nlm.nih.gov/pubmed/31035963,BMC psychiatry,2019 06 10,The purpose of our study was to identify predictors of a high risk of involuntary psychiatric in-patient treatment.,How many samples are needed to infer truly clonal mutations from heterogenous tumours?,https://www.ncbi.nlm.nih.gov/pubmed/31035962,BMC cancer,2019 06 10,"Modern cancer treatment strategies aim to target tumour specific genetic (or epigenetic) alterations. Treatment response improves if these alterations are clonal, i.e. present in all cancer cells within tumours. However, the identification of truly clonal alterations is impaired by the tremendous intra-tumour genetic heterogeneity and unavoidable sampling biases.",Evaluation of disinfection of surfaces at an outpatient unit before and after an intervention program.,https://www.ncbi.nlm.nih.gov/pubmed/31035961,BMC infectious diseases,2019 06 10,Cleaning and disinfection processes must be improved so that there is a reduction in environmental contamination of frequent-contact surfaces. The objective of this study was to evaluate cleaning and disinfection of surfaces at a specialized healthcare unit after an intervention program.,Transplantation and diabetes (Transdiab): a pilot randomised controlled trial of metformin in impaired glucose tolerance after kidney transplantation.,https://www.ncbi.nlm.nih.gov/pubmed/31035960,BMC nephrology,2019 06 10,Post transplantation diabetes mellitus (PTDM) is a common and serious complication after renal transplantation with significant morbidity and mortality. Metformin has proven benefits in the general population and might be advantageous in the prevention and management of PTDM.,Effects of physical exercises on inflammatory biomarkers and cardiopulmonary function in patients living with HIV: a systematic review with meta-analysis.,https://www.ncbi.nlm.nih.gov/pubmed/31035959,BMC infectious diseases,2019 06 10,"Pro-inflammatory cytokines expressed in human immune deficiency virus (HIV) infection, may induce oxidative stress likely to compromise the patency of the airways or damage the lung tissues/cardiac function. However, physical (aerobic and/or resistance) exercise-induced release of heat shock protein, immune function alteration or reduced tissue hypoxia, have been highlighted as possible mechanisms by which increasing physical activity may reduce plasma pro-inflammatory cytokines in uninfected individuals and should be appraised in the literature for evidence of similar benefits in people living with HIV (PLWH). Therefore, we evaluated the effects of physical exercises on 1) inflammatory biomarkers and 2) cardiopulmonary function (VO2 Max) in PLWH.",Predicting coronary artery disease: a comparison between two data mining algorithms.,https://www.ncbi.nlm.nih.gov/pubmed/31035958,BMC public health,2019 06 10,"Cardiovascular diseases (CADs) are the first leading cause of death across the world. World Health Organization has estimated that morality rate caused by heart diseases will mount to 23 million cases by 2030. Hence, the use of data mining algorithms could be useful in predicting coronary artery diseases. Therefore, the present study aimed to compare the positive predictive value (PPV) of CAD using artificial neural network (ANN) and SVM algorithms and their distinction in terms of predicting CAD in the selected hospitals.",A narrative analysis of women's experiences of planning a vaginal birth after caesarean (VBAC) in Australia using critical feminist theory.,https://www.ncbi.nlm.nih.gov/pubmed/31035957,BMC pregnancy and childbirth,2019 06 10,"Most women who have a caesarean can safely have a vaginal birth after caesarean (VBAC) for their next birth, but more women have an elective repeat caesarean than a VBAC.","GATA2 mutation in long stand Mycobacterium kansasii infection, myelodysplasia and MonoMAC syndrome: a case-report.",https://www.ncbi.nlm.nih.gov/pubmed/31035956,BMC medical genetics,2019 06 10,"GATA2 is a transcription factor that is a critical regulator of gene expression in hematopoietic cells. GATA2 deficiency presents with multi-lineage cytopenia, mycobacterial, fungal and viral infections. Patients with GATA2 mutation have a high risk of developing myelodysplastic syndrome or acute myeloid leukemia."
